video,frame_count,width,height,question,answer,qid,type,a0,a1,a2,a3,a4
8686972517,1144,640,480,what does the dog do as the girl with giraffe shirt jumps at the start,1,5,TC,fidget around,sat down,kiss the dog,follow,point in front of her
4719167605,821,360,480,what is the lady wearing in her hair while carrying the baby,1,7,TC,helmet,rubber band,spectacles,comb,sleep
3277667959,1681,640,480,what was the boy in stripe doing with his phone,3,3,TC,talk to person outside door,keep a book,puts it on the table,more comfortable,playing around
7539163668,561,640,360,what does the lady do as the baby is about to slip at the start,4,6,TC,push trolley,stretch hands out,take the balloon,give the toy to woman,hold baby and bend down more
3730211355,2180,640,480,what did the girl do when she was standing in front of the mirror,1,6,TC,point on screen,looks at herself,kneeling on the chair,wave and dance,walking
2873921227,1686,320,240,how did the lady react when the baby touch her face at the end,0,5,TC,smile,put face close to baby,carry baby,carry the baby up,plays with the baby
2582245375,439,640,480,what are the lady and the man doing,2,3,TC,playing piano,stand and listen,dancing,skiing,playing
5216965406,1201,272,480,how does the girl in pink position herself on the floor,0,7,TC,sit up,move the items on her hands,jumps,smiles,turns around and walk
3125769367,2492,640,480,how is the man with blue jacket positioned in the room,0,9,TC,sitting,start talking,lean on bed,standing,following him
5827678428,827,640,360,what did the man do at the middle of the video when he reaches the wooden area,2,6,TC,standing,puts it in the box,jump up,into his computer,lie down
2575603919,1797,500,375,what was the girl doing as the car passed by her,4,7,TC,run,jog the opposite direction,look upwards at lady,push the car,checking her hands
5845896914,1200,640,480,how does the adult react when the baby falls over,3,3,TC,climb on man,lie down,falls on the ground,moves camera,hold his hand
5573667855,662,640,362,how do the people feel while hanging out with one another,2,9,TC,tired,agitated,happy,cold,irritated
11019586455,847,640,360,what is the bigger black dog on the right doing with its tail at the start of the video,3,5,TC,bites him,bite the toy,walked away to the sides,wagging,try to bite it
10023613284,450,640,360,what does the speaking man do every time he laughes,4,5,TC,smoke,watching,engaged,excited and engrossed,bends forward
3738987127,632,640,362,what did the girl on the right do at the beginning of the video,0,7,TC,touch her head,point at camera,start claping,put toy animal onto train,reaches her hand out
5916212839,1350,480,640,how does the cat on the sofa react when the other cat jump up at the beginning,2,5,TC,jump onto couch,look at white cat,anrgy,stop moving and look back,play with ball
2440057130,836,320,240,where do the girls bring the chosen toys to at the end of the video,1,4,TC,something behind the camera,camera man,cover her mouth,basketball hoop,under the hen
6812027210,632,640,360,how did the baby feel about playing with the new toy,2,4,TC,sad,intrigued,happy,shy,angry
3349381835,510,640,480,how are the cats positioned in the video,0,0,TC,laying on the mat,stretches,zooms into the tap,walk past,playing
3452353148,780,640,480,what is the man doing,2,8,TC,eating and drinking,playing instruments,riding the atv,eating,modelling
3160575610,962,640,480,what does the girl in white do as the girl in red plays with the drum,4,0,TC,smiling,went into a room and closed the door,walk away,holding each other,play the guitar
7415842388,1101,640,384,how did the boy react when he first pick up the toy,2,1,TC,look into bag,kiss baby,smiles,pass toy to baby,retracts his hand
5098569613,1800,640,480,what does the baby do as the lady is about to kiss him at the start of the video,1,4,TC,talk,blink,kneeling on the sand,laugh,sit up
5336600324,1155,640,480,what is her left hand holding,4,1,TC,beads,walk away,pet dog,making hand gestures,toy
3421274363,1247,640,480,what does the girl in pink occupy herself with while in the car,3,3,TC,watching a show,checking her hands,draw,play with pink toy,look at camera
8106453629,2160,640,360,what was the lady in pink and the man in purple doing at the beginning of the video,0,7,TC,stand at the side of the stage,getting more paint on the paintbrush,raised 3 fingers,get off the scooter,turns around
8697708107,408,640,480,how does the person entice the cat with the food,3,7,TC,move the head,caress cst,follows the toy,move the bowl of food around,carry cat in arms
3909074331,1408,640,480,what was the girl doing as the two boys were digging at the start,4,0,TC,pick it up,singing,wipe on the bib,laugh,digging
4810437958,608,640,1138,how was the lady feeling at the end,2,9,TC,uncomfortable,tired,happy,shocked,confused
6826572178,795,480,800,what activity is being carried out,3,3,TC,giving speech,walk in the park,egg hunter,softball,dining
6149161928,2690,640,480,what did the girl in yellow shirt do when the lady in blue was reading the card,1,7,TC,takes flowers from girl in green,looking at card,no using phone,looking at her,speak and nod
3514392518,2084,640,480,what does the meerkat on the right do as the meerkat on the left was sitting and staring from the branch,1,1,TC,put on sofa,look around,push boy,licked the other cat s behind,moving ball on the screen
5770742977,425,640,480,who raises his hand while sliding,2,4,TC,boy in pink,boy in black,boy in blue,boy in green,boy in yellow
2580553233,837,480,360,how is the man feeling singing into the microphone,3,1,TC,having fun,bored and sleepy,afraid,passionate,angry
5868055864,2308,640,480,what is the boy in green doing in the video,0,2,TC,swinging,jump into pool,flips the page,riding horse,cups his face with his hands
8646868308,2160,640,426,what do the other people do as the man in blue speaks at the start,3,0,TC,sleep,showing others something,sitting,listen to him,run back to position
8019816081,733,640,360,what are the people doing,2,5,TC,go kart,snow sledding,gathering for food,shooting,rafting
8457813639,397,604,1072,what does the man wear on his nose while sledding,2,0,TC,shake his arm,close eyes,sunglasses,showering it,watch and then dig snow
4149141971,1320,640,360,what were the other people doing as the lady spoke in the start,1,6,TC,looking down at piano keys,listening,playing with sticks,lying on her stomach,dancing
4153535077,710,640,360,what did the baby do when the man brought the fork near his mouth at the start,0,6,TC,open mouth,eat,look at the baby,swing her arms,suck the spoon
13974254491,545,640,360,what does the man playing the piano wear on his head while playing,4,7,TC,raise his arms,girl moving and boy posing,put the mic back,sway body,a cap
4824132481,306,640,480,how does the cat react seeing the toy moving,1,6,TC,looks at the camera,follows the toy,scratch it,stare,bite it
5950108376,2554,640,384,what did the baby do to his shirt at the beginning of the video,2,7,TC,looking at toy on ground,pushing box,adjust shirt,sleep,lie down on grass
4810871515,1253,640,360,what is the boy doing as he consume his meal,1,1,TC,scrap table with spoon,watching movie,plays with red toy,bring it up and down,moving front and back
7483736240,1044,640,1138,how does the lady position herself on the couch,1,4,TC,playing with sofa,cross one leg over the other,touching glass bottle,relaxing,jumping
10387715274,525,640,360,what is the man in mascot doing,1,2,TC,rugby,waving to the camera,assembling structure and take out leaves,baseball,rock climbing
5817868766,386,640,360,how does the man react when the performance is done,0,10,TC,raise his hand,start clapping,put hand on head,jump around,stare at the camera
5697824411,374,640,426,what is the lady in black doing when seating beside the guy in blue,3,4,TC,talking,giving presentation,sitting,watching the guy,play piano
3267978905,1476,640,480,what does the boy standing next to the boy sitting down do while the boy plays the drum,1,6,TC,stretch legs,play the guitar,pat his legs,stand on boy s right,look through the box
7820929124,897,640,360,what does the girl do when she falls on the ground,1,3,TC,sit down,stands up again,got back up,go to the side,look down
3754789709,398,320,240,what activity are they doing,0,5,TC,trekking,kicking,discussion,horse riding,experimentation
12450142184,1363,640,480,what did the baby touch when he stretched his hands out,4,10,TC,bottle,yawns,thick clothes,put his hands together,cardboard box
7207925066,2697,640,360,what was the man in white doing as the man in red presented the slide at the beginning of the video,2,6,TC,teaching him to walk,look at screen,leaning against wall,dancing,change direction
3696891751,1377,640,362,how did the two men feel when they performed together,0,3,TC,happy,amused,bored,accomplished,cool
4329580374,712,640,480,what does the baby in white do as the baby in pink stared at her,2,4,TC,lying on her stomach,to walk the horse,smile,she is opening it,hit lady s face
5280626374,1056,640,480,what is the woman in a sari doing when a lady in white carrying a red car costume passed by,2,5,TC,look at sky,nose picking,adjust boy s costume,planting flower,stretch her hands
6016490500,660,640,360,how did the lady in hat react when she realised the video was on her,2,5,TC,stand in a corner,look away,look at camera,stand up,hug the dog
4072482970,378,640,480,what did the man do when the baby was clapping his hands,4,4,TC,sit behind her and guide her,kiss the boy in grey,put baby down,look at man,smiles
9383907547,410,480,640,what does the baby do while being held,2,6,TC,sleep,walking,move his legs,lie down,on his back
11313345705,754,640,360,how did the girl react to the boy s actions at first,3,5,TC,sitting on the log,look away,hold his hand,smiles,hold onto her dress
3116147520,2028,640,480,how is the baby feeling at the end,2,10,TC,restless,happy and dancing around,happy,aggrieved,do not like it
4081870381,1224,640,512,how did the person wearing the safety vest react when the car drove by,3,8,TC,turn their heads,point in the car,walk away,watch jeep,get out of car
6971584563,2412,640,360,what does the lady with black bag hold in her hands as she walks,2,3,TC,fan,clapping stick,self stick,oranges,yoyo
4715646346,915,640,428,what activity are they doing,3,1,TC,fire performance,swimming,rafting,fencing,obstacle challenge for dog
3914555606,1410,640,480,what activity is being carried out,0,7,TC,canoeing,roadside,playing,hiking,giving speech
13974254491,545,640,360,what is the man wearing on his head while performing,0,5,TC,a flatcap,lifeguard,sun glasses,walking down the hill,assembling structure and take out leaves
6918689312,960,640,360,what is the boy trying to explain,3,1,TC,how the toy walks,how to cycle,how to aovid pushing toy,explain how the tank works,how to jump
10626519064,1710,640,360,what were the children doing when the smoke rose at the end,3,1,TC,play the drums,starts clapping,try to crawl,looking at it,cry
4116882012,1655,640,480,how did the man in checked shirt react to the lady holding sword at the end,1,9,TC,lead the horse away,clap,speaks to the audience,pointed to his front,smile
2774651526,752,500,375,how do the people feel while riding the motorbikes,1,6,TC,frustrated,excited,friendly,worried,comforted
6161302721,1406,640,360,what did the lady in beige do when the lady in red walked past,1,1,TC,throw flowers,watch the man,looked down,read paper on table,pass her paper
5320487115,1001,640,360,how are the lady and man positioned as they spoke to the camera,3,4,TC,standing up,far apart,lying down,beside one another,one standing one sitting
3199291548,720,640,480,how did the machine respond when it is near the obstacles,1,3,TC,playing game,move backwards,happy,drive,turn left
6122730590,669,640,1138,what did the girl do when the man threw the ball,0,4,TC,stretch arms in the air,look around,pick another ball,kneel on the ground,move to the red ball
5460608032,714,640,360,what sport is the two people doing at the end of the video,2,5,TC,dancing,baseball,cycling,making music,playing guitars
6565487059,2697,640,480,what is the man doing as he sat on the chair,4,7,TC,rest,presses a button on the device,place hands on his thighs,drinking from water bottle,playing piano
2492733539,684,320,240,how did the man react when the baby laughed,4,4,TC,laugh and move feet,put into his mouth,clap,pick up bottle,laughs back
2663659410,912,500,375,what is the activity happening in the video,0,8,TC,people dancing,performing a song,talking,swimming,birthday
4073136069,1442,640,480,what do the children do as the lady moves the things in front of the girl in red at the start,4,0,TC,run off,look around,a tray,shake it,adjust their things
8072793932,1455,640,360,what are the kids doing at the beginning of the video,0,6,TC,squeezing tube,say something very quickly,opening a black box,spin themselves,playing a toy
4862215227,1470,640,480,what does the lady do when the baby lunged forward near the middle,4,8,TC,support baby,stretch hands ouy,look backwards,look at her,push baby back
11673419896,2415,640,360,what does the man in blue do as the lady is climbing,4,1,TC,sitting at the sofa,move her hands away,move stuff away,trolley,adjust the ropes
3319704607,857,320,240,what did the boy in green do when the boy in blue leaned forward in the middle of the video,2,2,TC,give them directions,throw it at dog,get closer to camera,holds the boy in orange again,turn on the wand
6789657160,830,480,640,what does the girl hold while being held by the man,0,8,TC,balloon,elephant toy,swing handle,bin,ponies
4366402470,794,640,480,how does the boy in red position his hands while on the horse,2,7,TC,guitar,standing,hold the saddle,reaches out his arms,riding
11277503743,347,640,360,what does the girl wear on her head,3,6,TC,gaming,bin,happy,beanie,applying cream on face
5932671106,1183,640,480,what does the striped shirt baby does when he gets the shoes,0,4,TC,lifts the shoes up,crawl after the foot,walk away,throw the shoes away,pass shoes to camera man
4520112789,1642,640,360,what did the person wear on his hand when he was caress the cat,4,11,TC,smells him,enjoying it,puts it back,use hand gesture,a watch
4308410480,2692,640,480,how does the boy in blue pants react when the boy wearig mask kick towards him at the start,2,7,TC,hold his legs,four,bend down,kick back,run off
3667765413,1170,640,480,what did the man in white shirt do when the man in colourful shirt was caressing the dog,3,6,TC,relaxed,happy,put white paper in front of dog,look at him,struggle
7055097657,1238,640,480,what did the lady in white do as the man was singing,2,7,TC,sway along with music,makes noise with a spoon,walk past him,play with toy,dancing
4976006471,2661,320,240,what is the lady in pink s expression as she talked to someone at the end of the video,3,4,TC,looked at camera,do a peace sign,moved her hand down slowly,smiling,talk to the audience
2681849266,2262,500,375,what pattern are they forming with the wooden sticks,1,5,TC,lying on the chair,create unifrom patterns,running in the forest,throw the stick in the air,curious
6855479096,1553,640,480,what is the first rabbit doing on the field near the beginning,0,0,TC,resting,bouncing away,looking around,eating grass,running
10717276603,2028,640,360,what does the boy do as the adult follows him behind,2,3,TC,touch man s hoodie,eat food,walk around the store,sit on swing,watching
6595030215,466,640,360,how is the man feeling while playing with the baby at the end,0,11,TC,happy,refreshing,irritated,sleepy and bored,alert
8954271057,733,640,480,how is the cat positioned in the video,1,4,TC,relaxed,sitting,happy,rub the cat,walk past
5873013017,1511,640,480,what does the baby hold onto as he swims,2,0,TC,helmet,swimming cap,float,plastic balls,other babies
4123326213,1545,640,480,what are the girls doing,4,5,TC,with their legs,applying cream on face,eating something,playing with her book,dancing
8888541668,1155,640,360,what does the lady at the back do as the boy is singing,0,0,TC,watch him,sing while playing piano,raise and clap her hands,sit on sofa and listen,move her hands around
3530395394,1416,640,360,what did the lone pig do right at the end,0,3,TC,run,looks around,turn one round,look down,put something on the floor
8212773822,1461,640,360,what does the lady do as the girl plays with the man,0,1,TC,watch,stand still,dancing,looking at arcade,cook
5945234319,1989,640,480,how does the girl rest her right hand as she eats the fruits,4,9,TC,on top of her head,at the sides of her body,on her hips,stand around and watch,on the table
2458584542,1405,320,240,how did the woman react when seeing the baby at the start of the video,4,1,TC,touch baby mouth,hanging clothes,step on the books and dance,point at something,smile
3217749642,2697,640,352,what did the black dog do when it approached the green toy,0,2,TC,bite it,drink from water bowl,barked back,walk away,lie down
3525082926,1036,640,360,what is the green man doing as the bowling ball rolls towards the pins,3,7,TC,put ball into hole again,pick up the ball,bowling,watching,crawl
7438153002,2697,640,360,what are the people on the field doing,0,5,TC,walking,ski,playing at arcade,making campfire,rugby
6043147104,1993,640,480,what does the lady do to the baby in the middle of the video,2,1,TC,pick up toy,feed baby,tickle baby,puts her hand on the blanket,crossed arm
2956592867,417,640,480,how do the boys protect themselves while skateboarding,1,0,TC,leans from side to side,wear helmet,touch it,walk,covered shoes
6027597248,2697,640,360,what did the lady in white do when she approached the baby at the end,0,11,TC,pick up baby,spit,hit lady s face,kiss the baby,walk to the girl in white
11841865713,675,320,240,how did the baby respond when the woman holds higher hands,2,4,TC,laugh,rocking baby,grab woman s finger,love,gesture
6521889201,1084,640,360,how does the child feel while feeding the goat,1,7,TC,reluctant,excited,sleepy,sore,upset
3503100437,1623,640,360,how does the baby react when the lady carrying it tickle it,1,9,TC,look at baby,no reaction,touches his head,cries,bring bag over
8702139498,813,640,360,what does the man in blue at the car do while the driver was adjusting his helmet at the start,1,1,TC,looking at carpark,adjusting car,walks backwards,look at it,nod
6572242521,1168,640,480,what did the white dog do when the man first threw the ball,1,0,TC,raise up a blue object,run to fetch,bring to the person,hit with racket,dropped
6210851682,452,640,360,what did the woman do when they reached the end in the middle,4,0,TC,walk away,look at her hands,pin her hair,adjust ropes,turned around
6856233194,883,640,360,who is the only one speaking among the team,3,3,TC,the boy in black,the lady in orange,the firefighter,the man in black and red,the policeman
6314990660,1866,640,360,what did the girl do once she caught up with the boy,2,7,TC,smiles,eats,watch him,sits on the log,licks ice cream
4217963817,1560,640,360,what did the girl do when the adult tried to take another spoon of ice cream from her at the end of the video,2,7,TC,funny faces,hand it to the lady in purple,bounce up and down,move over to eat another icecream,give to the man in grey
8714747002,307,640,360,what did the kid do while looking at the camera,3,5,TC,stand up,stretch out his hand,tried to touch camera,rotates head and makes faces,stick tongue out
6474943743,523,640,384,what does the adult do when the kid left the tree,2,4,TC,start to dance,pick up the balloon,turns around,hold his hand,walked away
5370747323,381,640,360,what is the lady in white holding while walking,3,4,TC,hold flowers,knife,phone,water bottle,gun
6061530960,2158,640,360,what did the man do when the baby in white approached the black box and touched it,0,11,TC,look at baby,move around,started talking and move hands,rest on sofa,play with cardboard paper
6971785627,2553,640,480,how is the man in black do feeling at the end,1,6,TC,aggressive,happy,alert,aggrieved,overjoyed
2698244043,1130,500,375,how did the group of people at the dining table feel while having a plate of food in front of them,1,9,TC,bored and uninterested,happy,friendly,sleepy and bored,angry
2432458239,517,640,480,what is the lady in thick clothing doing,4,3,TC,playing the guitar,ride horse,flying kites,cycling,release crab into water
4458565343,2561,640,428,what activity are the people on the boat enjoying,2,8,TC,surfing,sitting,sight seeing,singing,stand up
4946916131,396,640,360,what does the cat do as the dog is lying on the couch,2,1,TC,turn back,afraid,walk across sofa,looking at the cat,watching tv
10192494165,700,640,360,how does the girl with the book position herself in the car,3,8,TC,walk past the car,point at card,rock the pram,sit crossed legged,help to move the car
2764832695,930,640,480,what does the woman in brown do in the middle when the child on the swing swings backwards,4,12,TC,dance,push the boy,wave her hands at the girl,turned back to look,push forward
2547180255,1173,320,240,what does the baby do as he turned his head to the camera nearing the end,4,1,TC,look into camera,towards the left,put hand into mouth,stares at woman,smile
9170516863,563,640,360,how did the woman in sunglasses react in the middle of the video,2,3,TC,signing it,swing her arms,smiles,doing a vlog,stop and listen
11206371136,1308,640,360,what is the child doing in front of the drawing on the wall,4,3,TC,lean forward and put head down,playing the guitar,looking around,show off her drawing,watch the drawing
9201656937,1081,640,360,what does the dark brown rabbit do at the end,3,4,TC,sniff floor,ball,lying down,move away from other rabbit,walk
9615822553,1530,640,360,what does the man in checkered shirt do as the man in grey was opening his paper on stage,4,6,TC,playing the ukelele,using phone,playing music,performing,looking around
8782055272,330,640,360,what is the man in grey doing as the man in yellow run past the muddy place,1,8,TC,cycling,walking,throw snowball,dog rubbed something from man,throw ball
13256002144,842,640,360,what is the sport that the people are doing,2,1,TC,eating and drinking,rock climbing,ski,snow sledging,stage
3160575610,962,640,480,what does the girl in red hold onto as she stood up at the end,4,3,TC,watch the man,changing diapers,looked down,planting a plant,green toy
10035996655,300,640,480,what does the boy in blue do as the naked boy sits in the pail,1,1,TC,jump,pour water,slide down,play with his own camera,play with sand
2400074985,2280,320,240,how did the woman feel when she was the spinning herself with the bag in her hand,4,1,TC,does not like it,good,happy to hold the baby,enjoyable,dizzy
5719002896,1814,640,480,what are the audiences doing as the band is performing near the end of the video,0,6,TC,dancing to music,turn to the front,push the bottle down,run towards the camera,walk away from the table
5802161982,2697,640,480,what does the lady in white do when she approached the table again in the middle,4,6,TC,touch the cat,kisses the baby,turn back to her front,wipe the table,pass the plate
6901507844,2289,640,360,what did the lady do as she leaned on the sofa,1,4,TC,feed baby,play with baby,having dinner,stand still and walk away,sleep on sofa
8484188496,1927,640,360,what is the man in white doing,2,5,TC,performance,making a speech,painting,babysitting,dancing
5599511471,852,640,360,what sport are the people doing,2,4,TC,jumping,snowboarding,rugby,ski,rock climbing
2464012819,699,640,480,what does the boy do as the man sits on the sofa,1,0,TC,stand up,play with phone,bring the baby up and down,flipping pages,playing with baby
5928207977,1012,640,360,how was the cat feeling at the start of the video,2,10,TC,face got wet,curious about cows,sleepy,to drink water,referring to cat
9020947679,4172,640,360,what are the three boys looking at in the middle of the video,2,9,TC,go back to the side,push bottles in front,their two other friends,turn behind to look,puts it in the box
2705846557,1095,640,480,what are the men doing on this desserted hill,3,10,TC,playing piano,playing guitar,make turn,hiking,escape performance
3356104811,1629,640,480,what is the man in red doing,2,3,TC,playing guitar,look at baby,guiding,escape performance,skiing
4771138218,985,640,480,how is the lady on the right feeling while shaking her body at the end,1,7,TC,shy,happy,calm,concentrated,comfortable
6882604194,1927,640,360,what is the dog doing as the person rubbed its body,4,7,TC,look at baby,backed away,look back,chew toy,lie down
6016490500,660,640,360,what is the girl in purple doing with her shoes,3,1,TC,adjusting buckle,cleaning shoe,checking for tears,tie shoelace,taking off
5002226482,322,640,480,how did the girl react when the dog stopped licking from the cup,3,4,TC,put the fork down,put the fork in her mouth,sits upright,laugh,take spoon to eat
2662863658,2520,640,480,what was the man doing as the dog was licking him,4,6,TC,pick up the fork,look back,cover the cup,open its mouth,caress the dog
3065148567,382,640,480,what does the lady in red do when the camera approaches her,4,7,TC,watch and listen about flower,eat,take lollipop out,planting a plant,opening a packet
7049300643,656,640,360,what does the boy do while the girl is on the swing,4,0,TC,push girl off swing,yank the metal chains,walk around swing,lie down and sleep,pull and push the swing
6321835042,965,640,360,what do the other people do as the man in green was talking,0,1,TC,listen,opening bottle,looking around,taking video,shake hands
6122145394,897,640,1138,what does the girl do as the baby sat next to her,4,0,TC,eating,moving,looking at a book,sleeping,playing with ball
5254588486,1008,480,640,how does the baby interact with the sock,1,8,TC,pull out her sock,bite,hit the toy,hit her foot,laughing
5231615174,2687,640,360,what were the other people opposite the lady with a bun doing as she spoke,3,3,TC,reading,walk away,sitting around table,listening,touching baby s hand
