video,frame_count,width,height,question,answer,qid,type,a0,a1,a2,a3,a4
7417682572,1816,640,360,what does the man playing the drums do with his feet as he plays the drum,1,2,TC,look through the box,moves his feet,smoke,walk around the hoop,cap
2400987326,2576,320,240,how is the man in grey plaid shirt feeling while talking at the start,4,5,TC,worried,terrible,curious,frightened,happy
8903248754,551,640,360,what is the other boy doing while the boy with green shorts jumped at the end of the video,3,7,TC,catches it back,lean over to man,throws the ball,looking at the boy,fold his arms
4567287291,1748,360,480,what is the person on the bed doing as the baby plays,4,2,TC,lying,standing and moving hands,takes support,happy,sleeping
5379354799,1467,640,1138,what did the lady do when they reached the bush,0,6,TC,point at pumpkin,let go of balloon,reach her hand out,point at camera,pat dog s head
5085607670,1830,640,360,how do the people on stage react when the lady in green makes a dance move,0,4,TC,followed her dance steps,smile,touch their hair band,lie on floor,move away
2549562657,884,320,240,how is the baby in blue shirt positioned,1,5,TC,heat up metal,sitting,standing,sitting at the sofa,throw away the blue toy
4527426680,592,640,360,how does the girl react while watching the blanket,4,9,TC,walk away,bend down,show his bottle to camera,relaxed,laugh
8748339924,490,640,480,what does the pig on the outer left do in the middle of the video,0,0,TC,walk away,move,shake itself,go back,follow the hand
8290475933,870,640,360,how did the man position his hands while speaking,3,8,TC,hold the microphone,put into pockets,push the trolley,hug the lady,strum the string
12464813773,1299,640,360,what is the pink colour board the pink girl is holding for,1,1,TC,swinging her arms,sleigh,smiling,look back,happy
3537017298,963,640,480,what activity is being carried out,1,6,TC,fencing,eating,printing,presentation,woman talking to the crowd
5996570774,728,640,360,how is the woman feeling while playing with the girl in grey,0,8,TC,bored,embarrassed,scared,enjoyable,blessed
6247230354,2370,640,480,what are the people doing in the video,3,10,TC,paragliding,playing guitars,climbing tree,trekking,buying drink
9069281283,303,640,360,what did the man in black do as the man in brown walked up the stairs,1,1,TC,eat the jelly,watch him,camera,happy,look towards the man speaking
7722027264,1658,640,360,what was the groom doing when the bridge was giving her speech at the beginning of the video,2,11,TC,run,pull skirt up,looking at bride,pretend to punch him,get out of car
8655296645,1425,640,360,what does the lady in brown skirt do while the lady in jeans disappears from the video for a while,4,8,TC,lean to the side,claps,look at ground,get in the pool,play with baby
2482994684,1284,500,283,what does the boy do when he first stretched his hand forward to the table,0,3,TC,put the class down,go behind the purple pillar,look back,talk to boy,look at the laptop
5309902755,2052,640,480,what is the girl in white doing while the girl in black plays the violin,3,6,TC,dancing,look down,hit the drums,sitting on sofa,hula hoop acrobatics
3954996353,1534,640,480,what does the man in white do when he walks onto the stage,4,0,TC,sing,stares,pass paper to woman,does hand gesture,clap hands
4435031690,993,640,480,what does the man with the camera wear on his head,2,1,TC,swimming cap,singing,helmet,bandana,sun glasses
3633333753,1197,640,480,what does the man with a cap who is seated down do with his hands near the end,3,4,TC,talk,hand gestures,arm rest,pointed to the sea,looks upward in surprise
4682821606,1002,640,360,what roles do the man in the plan shirt and the man in green play in the activity,2,2,TC,stand there,holding man in black,guide the tractor,swinging,construct toy structure
4932338665,621,320,240,what did the brown dog do when the black dog first ran away,0,4,TC,chase the dog,fight back,mount the black dog,touch its face,bite and push
3495538595,486,640,360,how did the lady react when the man in black let go of the kite,4,7,TC,point in front of her,sink,pick surfboard up,stand beside the swing,start running
6458302923,1340,640,360,what does the cat hold in her mouth,0,1,TC,spoon,lollipop,paper,sand,watch
9586602092,2089,640,480,how did the man in red react to the man in black talking to him,4,6,TC,sitting on chair,stands still on the left,turn back,took off goggles,look at him
7494795252,1549,640,1138,what does the boy do as the lady stands at the side,3,3,TC,blue,lying down,stretch her hand out,swing,sofa sheets
6977693305,595,640,426,what does the person do as the baby is seated down,4,1,TC,sitting with hands down,kiss baby,pat his back,lying on the chair,feed baby
4590908780,456,640,360,what did the lady do while the boy is presenting,2,9,TC,sitting on the log,eating,look at boy and listen,flying kite,walk off
5703075703,825,640,360,what does the man in stripes do while the man in blue stands next to him,0,0,TC,look at poster while sitting,pose,plays the drum,adjusting the rope,hold the man s hand
3525082926,1036,640,360,what did the man do as he walked back to get another ball,0,2,TC,shake his head,look at ball,bring jacket away,chase,runs toward the ball
4889389323,1118,640,362,how did the lady protect the girl from hot sun while the girl was tying her shoelaces,4,3,TC,pick out clothes for girl,hold girl with her hands,pushed it,guide woman with her hand,shelter umbrella over her
5873391334,2697,640,480,what do the girls wear in their hair while dancing,1,5,TC,a tie,hair band,a comb,walking,start crying
4573348751,2078,640,480,what activity are the people in the video doing,4,10,TC,drawing,eyebrows threading,paragliding,trekking,making music
5312036289,2158,640,360,what does the boy do as the girl placed the ball into the hole,4,4,TC,give ball to the lady,talk,turn to look behind her,falls off,touch the toy
5403958484,2697,640,360,how are the three ladies positioned,2,5,TC,messy line,beside a flying fox,stand in a line,back to back facing,beside the golf course
10815616364,935,640,360,how does the girl on the right feel at the end,2,6,TC,sleepy and bored,happy and dancing around,tired,excited and engrossed,pleased
2547045867,2280,640,360,what is the response of the man in grey towards the change in direction of the wheels,3,6,TC,look at man in white,drink,sit at table,continue to look and direct,wave
8373966120,1316,640,360,how did the boy respond when he saw the girl dancing at the start of the video,4,4,TC,turns the baby over,spin themselves,touch baby mouth,spinning in circles,start moving hands
4729027639,2161,640,480,what are the girls holding as they stood in front of the whiteboard,4,0,TC,walk to the girl in white,put her arms up,blue,green toy,booklet
8120629936,1527,640,360,what do the two girls do when they first approached the bench,2,1,TC,take the balloon,sitting on the log,carry bench,stop and look at boy,cover her mouth
5630988927,2024,640,480,what did the baby do when he reached the tree in the middle of the video,2,3,TC,dance,catch the ball,stand up,toss ball down,close his right eye
5153854160,2265,640,480,what test is happening,1,8,TC,lady playing with baby,time for laptop to start,presentation,boxing,snow sledging
7047414375,960,640,360,what do the two other children behind do near the end of the video while the girl plays with the ball alone,3,8,TC,clap hands,look at the baby,run to pick up the ball,pass ball to each other,camera man
6249077230,1038,640,360,what are the two birds doing,0,6,TC,pecking,look down at the grass,eating,disturbing the dog,eat the seeds
4691227795,711,640,480,what did the lady do with her hands as the man cleaned the baby,2,1,TC,move his hands,approached the boy,leave them faced upwards,let go of vacuum,shake baby up and down
5689282153,1273,640,480,where did the orange fishes go when they swam upwards,1,1,TC,to the grey fishes,screen on the left,towards the rocks,away from the plant,to screen right
10011555465,801,640,360,how do the players position their legs when competiting,1,4,TC,cross,wide apart,fold,stand on one leg,link arms together
5765473409,2517,640,426,what does the man do as the girl was playing with the dog,1,0,TC,look at baby,give food to girl,stop the dog,moved back to the wall,no reaction
8323238963,1155,640,360,how is the woman feeling as she is coming down the slope,1,4,TC,surprised,scared,disappointed,restricted,amused
6859121305,1429,640,360,what are the people playing,2,1,TC,go kart,ruby hunting,beach volleyball,rock climbing,reading
5120998454,677,640,1138,what did the dog do when the toy stopped moving for a while,2,4,TC,run to the other side,resting,stop moving,watch dog move away,continue rubbing dog s head
3786675801,1177,640,480,what was the other dog doing while the black dog snatched the tree branch in the second half of the video,4,5,TC,sniff ball,crawl towards camera,runs away to the room,run away,walk around bushes
6359276855,1980,640,480,what do the black dog and brown dog do when the white dog approaches them in the middle,2,8,TC,lie down,ready to run away,run over to white dog,barked back,roll over on ground
2612683715,606,640,480,what are the two people doing as the parrot is moving around,2,0,TC,flies away,feeding,looking at parrot,looking at plane,bend down
2411282239,1441,500,375,what is the woman in blue doing with the camera,3,3,TC,riding,playing piano,smile,filming the process,hat
5388595493,1350,640,480,what is the baby doing,1,2,TC,watching video on tablet,playing with the toy,dancing,running in the forest,resting
2505388529,928,640,480,how did the dog react when the man touched its ears,1,5,TC,carry dog up,close eyes,enjoys it,caress the dog,calm
4854853022,1218,640,480,what were the two girls doing,0,5,TC,kayaking,playing instruments,singing,calling somoeone,sitting in the canoe
11961400954,1202,640,360,how did the lady with the grey hat react to the man next to her,0,4,TC,laugh,play with dog,looks at him,run up to talk to them,touch her face
7001183247,2697,640,480,what did the man in black do when the man in white is ready to push another man,4,4,TC,focus on pumpkin,make space for walking,stop the man,adjust seating position,watch him
5760068749,687,640,480,how is the baby positioned at the start of the video,3,8,TC,shaking hands,standing on the chair,leaning on the wall,standing at the table,lying on the bed
4972231631,917,640,480,what is the baby doing throughout the video,4,6,TC,dog having a bath,giving speech,lady petting horses,sightseeing,looking around
4519976041,2697,640,480,what does the man do while sitting down,1,0,TC,showing off toys,vape,blowing balloon,tired,presses a button on the device
2668548025,1408,500,283,what did the lady holding the cardboard box do when she approached the table on the right near the start,3,4,TC,moves around,by her hands,walk away,emptying cans,bring to man
2513801289,900,320,240,what was the man in checkered shirt doing as the lady was on the sleigh,0,1,TC,watching her,position herself to slide down,stands in front of camera,jacket,happy
3096078017,1281,640,480,what was on the screen when the child was trying to close the laptop for the first time,1,7,TC,touch keyboard,shapes,excited,stand and push box,stare at man
6236608754,740,640,480,how is the baby positioned on the floor,1,5,TC,lying on belly,sitting with hands down,on his head,standing up right,lying on its back
3815035749,750,640,480,how did the pony react to the children s greeting,4,1,TC,close eyes and open mouth,move trolley backwards,blow candle,jump around,unaffected
6324607259,669,640,360,what happen to the elephants ears as the elephants walk,2,4,TC,dangles in a spot,brushes the other elephants ears,flap around,goes up and down,resting
3682464291,2609,640,480,how did the girl in green react when she recognised someone in front,1,8,TC,look at the paper,wave,let go of boy in blue,push him away,kicks again
4672243606,682,360,480,what is the lady doing as the girl stands next to her to pin her hair,2,3,TC,dance,shake his hands,sitting down,paper and jacekt,point also
10735513724,728,640,360,what is the colour of the shirt the girl on the swing is wearing,4,7,TC,red,light blue,white,green,pink
3748127688,2697,640,480,what did the other black dogs do when the small brown dog with a cone ran away from the grass in the middle,3,7,TC,run around,follow him,run away and sits down,walk away,look at them
4599618003,2194,640,480,what is in the boy s mouth as he tries to walk,0,0,TC,pacifier,his left hand,straw,drink pack,paper
4006742735,1350,640,480,how are they feeling as they share this ice cream on a hot day,4,3,TC,confused but calm,concentrated,dismissive,sleepy,happy
8331827659,2697,640,360,how does the baby react when the man reaches out his hand the first time,1,7,TC,stare at camera,retracts his hand,play with baby s hands,cover himself again,stand there
3354627944,1287,640,480,how is the baby feeling when he plays the toy,4,3,TC,restricted,good,bored and sleepy,restless,relaxed
11111957393,1062,640,360,where did the boy in green go to when the blonde girl was touching the toy radio,2,10,TC,in his left hand,sofa,behind the sofa,basketball hoop,on his cheek
6068085283,1782,640,350,what activity is the woman carrying out at the beginning,4,7,TC,playing piano,skiing,playing with toys,thrash,picking
10354698406,451,640,640,how did the lady feel while playing the piano,1,2,TC,do not like it,relaxed,thrilled,curious,happy wagging tail
3801421295,600,640,360,how did the man feel while performing at a balcony,1,3,TC,amazed,happy,curious and happy,feel relaxed and happy,passionate
3779525241,550,640,480,what is the bear doing,3,0,TC,resting,through the holes of the door,playing driving game,playing,running
10364623445,714,640,360,what are the two children doing in the room,0,10,TC,playing,watching video on tablet,painting,playing with balloon,dancing
8626931151,2160,640,360,what was the kid wearing while playing,1,3,TC,pink shirt,bathrobe,sport attire,jacket,red pants
13693908355,717,640,360,how do they feel while in the water near the end,2,3,TC,likes,calm,happy,enjoyable,slightly embarassed
9046879738,1800,640,480,what did the man in black do at the end while the lady was holding a leaf with rice on it,1,4,TC,wash his hands,grab rice onto leaf,wipe the table,carry the gir up,make space for boys
3020873495,2396,500,375,how did the baby feel throughout while swinging in her seat,2,1,TC,enjoy performance,nervous,relaxed,attentive,carefree
3196912028,1368,640,480,how did the group of children behave during arts and crafts lesson,2,5,TC,fidgeting,playing,obedient,curious,smile
4283455837,853,640,360,how does the man feel while he is reading,0,8,TC,happy,move body and stamp feet,enjoyable,happy celebrating the girl s birthday,enjoying
4963040001,2697,640,362,how is the baby feeling playing with his toys,2,3,TC,afraid,awkward,happy,having fun,tired
7751455900,2697,640,1138,how is the baby feeling,3,8,TC,agitated,does not like it,shy,happy and excited,find it funny
6474904881,807,640,360,how did the man react when the girl swung the bead chain at him,3,6,TC,stands still in shock,add to the fun by hitting back,moves away from him,frowns and touches his face,goes for a jog
8106453629,2160,640,360,what did the lady in pink do when she say the man in purple walking towards her,3,1,TC,flip the page,watch the girl,hit her with cushion,walk towards him,watch the man
8207664482,1626,640,360,how does the baby react seeing the toy moving around at the end,2,8,TC,lying on his back,bites it,smile,stares at camera,move around
2582245375,439,640,480,what is the man doing as the lady spin around herself,4,5,TC,doll,applying cream on face,observe,plays the instrument,twirling her
3039274443,1800,640,480,how did the woman in stripe shirt react when he turned to her,2,7,TC,pass the ipad,look away,smiling,looks at them,said something
5206737488,1105,640,360,what did the lady in grey do as she spoke to the lady in grey at the end of the video,2,5,TC,put the box aside,run to camera,stand up,point somewhere,shake her head
3215327042,1306,640,480,how are the people feeling looking at the board together,1,3,TC,dizzy,satisfied,happy whenever the man kisses them,tired,serious
2822014581,1018,640,480,what is the man trying to demonstrate on the led screen,2,0,TC,walks forward,fishing,animated movement,eats something,press button
5585209771,1080,640,480,what does the man leaning back on the sofa on the opposite side hold in his hands,0,0,TC,cup,jump on man s leg,playing with baby,play the drum,blue toy
13636674714,2373,640,360,what did the man do when the lady took the food and walked to the table,1,9,TC,take out candle,walk over to table,wipe her hands with tissue,picks the food with hand,let girl blow the candle
5461088507,1464,640,480,what do the people do when the camera films them,0,1,TC,wave,playing guitars,walk nearer,eyebrows threading,performing stunts
3124632694,578,320,240,what do the boys do as they slide down,1,4,TC,falls,hold each other,move his arms,waves his hand,touch the cat
5314486265,1050,640,360,what did the bird do near the middle when the baby girl touches the bird,3,5,TC,touch the baby s stomach,stand at sofa,holding fruit,jump,bring book closer to baby
4609514164,366,640,480,how did the cub in front react when the other cub walks behind it,4,2,TC,touch lady s head,pulls the dog,wag tail,touch dog,looked behind
7619429394,1283,640,360,what is the man doing as he stood at the side,1,5,TC,performing,watching,showing us an experiment,he is dancing,sit on swing
3565236462,694,640,474,what does the man in white do as the man in brown was bending down at the start,2,7,TC,wipe his eyes with towel,talk and explain game,walks away,think for a while,observe
3757991702,683,640,480,how did the boy feel while sitting quietly on the public transport,1,2,TC,proud,bored,having fun,adorable,shy
4748191834,798,640,360,how did the woman in black react when the boy started crying,0,4,TC,move towards him,talk to baby,continue talking,give thumbs up,move the toy again and again
6991481998,1680,640,360,what did the lady do when the boy stopped in the middle of the video,0,3,TC,touch his head,carry him up,put him insede box,push green obstacle away,talk
5043069974,1845,640,480,what are the two people doing in the video,4,9,TC,swimming,working,adult playing with girl,cooking something,performing
3958390317,963,640,480,what does the man in white do as the man in black was hammering,2,9,TC,move the shovel,laughs,stand on ladder,hand gesture and talks,clap hands
3192619327,2697,640,480,how does the woman react while reading the card,2,6,TC,jump on bed,hold the cardboard,smiles,diapers,walk to show camera
5849618622,1800,640,360,what did the man in blue pass to the lady at the beginning of the video,2,11,TC,helmet,jacket,cigarette,dog,baskets
10157549466,300,640,480,what does the boy with striped shirt do as the shirtless sits next to him,0,1,TC,plays with controller,playing with toys,blowing balloon,talking,lie on floor with legs up
8208931952,574,640,360,how does the baby seem to be feeling when he saw the toy,4,5,TC,calm,frightened,worried,sleepy,happy
5246766161,799,640,360,how did the girl feel when feeding the dog with food,2,5,TC,happy while learning,having fun,thrilled,sleepy,proud
7729753698,451,640,362,what happens to the face of the man in white while he chops the coconut,0,2,TC,frowns,fall down,start running faster,wait for teammates,picks up the pancake
5588927672,2166,640,1138,what does the man do whenever he drops a baton,4,8,TC,shouts,remove cap,swing himself,prepare to change the baton,pick it up
3192619327,2697,640,480,how did the woman wearing grey feel while reading the large card,0,2,TC,happy,feel accomplished,accomplished,refreshing,cold
5208873554,2254,640,480,how did the boy feel while the bicycle is moving,4,7,TC,calm,happy celebrating the girl s birthday,attentive,embarrassed,happy
6043147104,1993,640,480,how did the baby react when the lady tickled the baby in the middle,2,2,TC,play with flies,pull on string,shake body,touch the cat,look at window
2403641837,1226,500,375,what was the man recording with his camera at the beginning of the video,4,0,TC,fishing,compare the two phones,into his computer,mirror,himself in the mirror
10576728026,741,640,360,how did the boy in black feel when the man behind him passes him another candy,4,4,TC,thrilled,upset,feel accomplished,happy and dancing around,happy
7612846664,1005,640,360,what was the person in red doing as the man was speaking,4,4,TC,attach man on ground to him,flying fox,speaks,happy,take photos
4960594555,2276,640,480,what did the man in blue do at the end of the video,0,2,TC,use his phone,moves his hand,points to the right,take another bite,stop running
2758143839,719,320,240,what are the 3 ladies in black doing when the lady in pink is holding the snake,4,3,TC,cleaning the boy with tissue,hug woman s leg,performing,check message on phone,supervising
7071234637,963,640,480,what did the girl do when the dog walks away from her,4,6,TC,place paw on her palm,looking at the dogs,points at the door,turn one round,pulls the leash towards her
8483279367,876,640,360,what emotion does the man in purple convey when he walks over to the man in the leather jacket,4,4,TC,unsatisfactory,confidence,happiness,sadness,excitement
11854356446,1161,640,480,what does the lady in jeans hold in her hands,1,9,TC,chair,a mop,bag,jacket,swimsuit
4435031690,993,640,480,what does the man in light blue do as the man in white was filming him at the start,4,3,TC,play with his own camera,looks out at the sea,stand still and talk,smile and pose,talking
5294402824,630,640,360,how do the women feel while hanging out,1,7,TC,frustrated,happy,adorable,angry,sad
2955511140,405,640,480,what does the guy in red do as the camera man was filming,1,2,TC,fishing,take photo,fires it off,roast coffee,dancing
3522471594,2250,640,480,what is the lady doing as she sat in the chair,0,1,TC,looking around and talking,looking at stuff,place the blue bottle down,carrying the baby,kneeling on the chair
3163206354,1368,640,480,how did the girl feel when she saw that she was caught on camera,4,5,TC,sleepy and bored,does not like it,move hands on it,attentive,unhappy
10433664864,729,640,1138,what does the boy do as the girl spoke in front of the microphone,2,0,TC,speaks,beside one another,play instrument,teddy bear,stand at the side and watch
9221037919,1645,640,360,what was the woman standing up doing as the girl sat at the table at the start,3,4,TC,dancing,stand up,scoop icecream,setting up table,pass the plate
5591479226,705,640,360,what are the man and lady doing in the video,3,8,TC,buying drink,playing guitars,walking the dog,dancing,playing with sand
4861754967,756,640,360,what is the man doing,0,0,TC,showing us an experiment,putting up a cloth,feeding cat,jump,moving his hand
12212440674,435,640,360,what do the kids do when they lie on the ground,1,4,TC,playing toys,move their hands,holding the ball,sitting with hands down,feed baby
7188203256,720,640,360,how do the children feel while hanging out,1,11,TC,sad,happy,sleepy,scared,shocked
3058613626,677,320,240,what does the other man standing behind do as the man with red hat is singing,3,6,TC,shake his body and arms,stop playing after awhile,playing the keyboard,playing drums,stand and watch
5365441719,2239,640,480,how did the tiger under the tree react when the two other tigers came over at the start of the video,1,7,TC,stand up,ignore them,chases after the other tiger,move its head,laugh and hold a tree trunk
6911198917,672,640,480,how does the person at the corner of the video react when the lady gets off the float,0,4,TC,smiles,dance,touch her hair,rolls on the ground,dance with hands
4698087865,1340,320,240,what is the lady doing as she sang on the stage,4,7,TC,nodding her head,move shoulders,pocket in dress,hit the drums,playing the guitar
2439266317,1313,320,240,how did the girls feel when they see themselves in the tv,4,2,TC,confused but calm,worried,excited,calm,happy
4825249972,926,640,360,where did the cat run when the dog was chasing it,4,8,TC,table,sink area in kitchen,same direction as dog,black chair,dining table
8252119570,1857,640,360,what is the lady in yellow shirt doing behind the other ladies sitting on the chair in the beginning,2,3,TC,watching,opening her present,adjusting techincal stuff,sketching on the laptop and table,sit down
6903773975,865,640,1138,what does the lady with rope do while the boy and dog were near the waters,4,3,TC,stand at the side,move forward,place dog back onto float,looking at the baby,call them back
12864348785,1246,640,360,what activity is occuring,0,5,TC,karaoke,giving speech,presentation,playing instrument,fire performance
8329319376,2250,640,480,what is the man holding in his hand while speaking to the woman,4,1,TC,hand gesture,laugh and made hand gestures,camera,walk around,teddy bear
3958035559,1770,640,480,what does the baby do while on the baby seat at the start,3,6,TC,suck his thumb,standing close while watching tv,the toy,look at toys,hands in mouth
4389577717,1241,640,480,what are the audiences doing while the three men were performing,3,7,TC,look at baby,looking at the car,singing,watching,walking down the hill
3090695613,739,320,480,where is the kid in white going as the girl in stripped shirt are climbing the slope,4,8,TC,follow the girl,standing around,dance hall,another side of the road,walk off
3121889229,349,640,480,what does the boy in white do in the video,2,0,TC,drinking,lying on its back,run towards the camera,playing in the pool,playing with book
3653939911,1185,640,480,what is the brown hamster doing at the back of the brown hamster who is eating,2,5,TC,strokes it,bark,tired,attack the black dog,walk across sofa
9996338863,1817,640,480,what event is happening,3,7,TC,birthday celebration,rollerblading,diving training,concert,celebration
