video,frame_count,width,height,question,answer,qid,type,a0,a1,a2,a3,a4
2429355433,1635,320,240,how does the girl feel while pretending to play the ukulele,0,7,TC,happy,relaxed,worried,focused,blessed
6023758564,2697,640,480,how is the baby positioned,3,9,TC,standing up,in woman s arm,happy playing with the toy,lying on the chair,eating
6974457528,1036,640,480,what does the girl do as the dog moves around to eat near beginning,1,3,TC,smiling,point to the food,moved back to the wall,holding fruit,point towards the dog
7384073506,1138,640,360,how did the baby feel when he touches the microphone and camera,3,0,TC,dismissive,enjoy performance,passionate,happy,cool
2783505892,2697,320,240,what were the rest of the people doing next to the white haired lady,3,3,TC,touching her head,smiling,play with leash,listen,sit down on the floor
4494886746,355,640,480,how does the woman feel while feeding the kangaroo,3,8,TC,excited,bored,dismissive,happy,feel accomplished
2460342203,488,240,320,what does the lady in singlet do as the people were sitting on the sofa,1,0,TC,walk to sofa,demonstrating,relaxing,cross legs,yes because it just stays still very peacefully
3447876447,729,640,480,what is the cat s reaction to the girl talking to her,2,1,TC,child likes it,paper and microphone,licks girl,look at boy,laughs
4866672246,1260,640,480,what is the small white dog doing between the person s shoes,1,7,TC,run over to white dog,looking for food,sniffs and run back,moves away,moves them towards the baby
7533044888,472,640,1138,what are the cars doing in the video,2,2,TC,working,paragliding,driving past,playing guitars,throwing stones
5277343380,2467,320,240,how do the girls feel while dancing,2,8,TC,angry,anxious,happy,upset,distracted
6692501229,1425,640,360,what did the man in pink do as he watched the man in white play his instrument,1,2,TC,put his head down,touch his nose,jump around,sway his body,sit around and listen
3512005907,1214,640,360,what does the lady in grey at the back of the room do as the girls are practising,2,1,TC,moving on the sofa,look,acting to dance,sit down,go into the building
6200966292,1455,640,360,what does the girl do as the man flips the book at the start,2,2,TC,read,shakes her waist,flip the book,looking at her,giving attention
3018394896,811,640,480,how do the ladies feel as they dance,4,9,TC,confused,laughs,feel relaxed and happy,tired but happy,happy
3339159151,681,640,480,how is the girl positioned on bed,4,6,TC,put a pacifier in baby s mouth,playing with cup,having dinner,playing with balloon,lying on her stomach
2970068527,1125,640,480,how does the boy react when the lady blows the foam,2,8,TC,put his hand up,watch and smile,laugh excitedly,do hand gestures,folds the dough
7672276754,957,640,360,what did the lady do when a huge wave approached the baby,2,8,TC,clap,sit up,lift baby up,shakes her head,happy
6591879935,1783,640,480,how did the two children feel when they were touching the man s guitar,4,0,TC,adorable,sad,dismissive,agitated,interested
9845820485,416,272,480,what does the boy in white do at the table when the others are sitting opposite him,0,0,TC,classroom,talking,eat taco,raise cup,looking at toys
5337165834,1042,480,640,how did the boy in red stripes feel playing with the toy,0,4,TC,excited,distracted,curious,emotional,angry
9487512217,521,640,360,how did the children react when they come close to the camera,2,6,TC,confused,drawing,stick tongue out,running in the forest,close his eyes
2467532859,611,640,428,what are the men doing initally,2,0,TC,riding bicycle,playing instruments,putting hand above girl,water ride,playing the guitar
5250385918,2677,640,360,how does the girl position her hands as she tried to get on the trampoline,3,6,TC,lie on the floor,hold mother,spinning around,hold the cupboard,holding book
3067456353,882,500,283,how does the boy in yellow position his hands while he is spinning,0,6,TC,in front of him,put into pocket,touch the forehead,touch the ears,crawling
6608207333,2697,640,1138,what does the bald man in black do as the girl in red sings,4,1,TC,clapping,playing piano,playing drums,clap for man in black,listen
2640440327,552,320,240,what did the lady in blue do with her hand at the end of the video,4,1,TC,cry sadly,does hand gesture,watches the girl,signing it,cover her face
2962536398,625,500,375,how did the man with tattoo positioned his hand when he was standing in the water at the beginning of the video,4,11,TC,run away,face,write on book,touch his nose,on his hip
7121723227,420,640,360,what is the woman doing with the baby,1,2,TC,try to crawl,rocking baby,feed baby,carry bbay in arms,playing with toys
3711049755,1095,640,428,what does the lady in green do as the two children blew the boat at the start,3,7,TC,supervising,walked into the water and picked it up,passerby,blows the boat,paddle
2581312980,1455,640,480,how are the men feeling during the conversation,4,6,TC,comfortable,uncomfortable,shy,does not like it,engaged
12620917425,1815,512,288,what did one of the elephants do when the two baby elephants run into the water,3,2,TC,tries to push it forward,jumps toward the food,shifted away,guide the baby elephants,resting
4822747943,2402,640,362,what does the girl do as the candle was being lighted,1,1,TC,lights the other cake,watch,blow out the side candles,get the paint,light up candle again
6149946189,1450,640,360,what did the girl point up in the sky near the middle,0,7,TC,moving helicopter,butterfly,paper aeroplance,flying tissue paper,bird
3049423208,400,500,375,what did the man in black do when he saw the two ladies peeking,4,2,TC,use phone,hold chopsticks to his tongue,makes noise with a spoon,looking into temple,run up to talk to them
13515443525,938,640,360,what did the dogs do when they stopped running in the middle of the video,3,4,TC,want to bite the hand,walked away to the sides,sniffing,sniff the grass,turn around
5296191052,1625,640,480,what does the man in the centre do as the two men stood next to him,2,1,TC,laugh,talk to the shirtless man,pose,start exercising,walke down the hill
5309902755,2052,640,480,what is the lady doing while the girl plays her violin,1,5,TC,use her palm,holding book,moving up and down,raise and clap her hands,sit and listen
3832090694,1215,640,480,what activity is being shown,1,8,TC,archery,elephant riding,interview,carrying baby at beach,learn dancing
8152470819,691,640,360,how did the cat on the mattress react when the other cat jumped up on the mattress,4,6,TC,look at it,jump down,jumped back,hide behind drawer,watch the cat jump up
2512546598,358,320,240,what activity are the two men doing,1,9,TC,pressing buttons,skiing,riding bicycle,eating while falling asleep,happy
9661791267,963,320,240,what did the boy do when the ball landed on the ground near the end,1,1,TC,look at ball,prepare to swing again,bowls again,hit with racket,chase
5802161982,2697,640,480,what did the man do as he lifted up the plate at the end,4,9,TC,tap it,play the guitar,take out price with knife,dance,raised his hand
2442932012,2697,500,375,what is the panda doing,3,3,TC,climb onto lap,trying to eat,cleaning each other,playing with orange toy,pick up food with mouth
6782372702,924,640,360,how does the cat react whenever the human touches it,4,6,TC,relaxed,licking itself,upset,excited and fidgety,move away
3013532781,319,640,480,what does the boy do as the man stands behind him,4,3,TC,hold man s hand,walks forward,cooking,walk around the store,sit on swing
3105754589,1413,640,480,what does the man do when he approached the dog,1,1,TC,grab the toy,carry dog up,chasing its tail,sit down,climbing up
3133586911,733,640,480,how does the man react to the baby yawning,3,3,TC,pull away,play with book,hit the man chin,smiling,stopped crying
3068268028,736,640,480,how is the baby feeling while eating the fruits at the start,3,3,TC,shaking,serious,affectionate,happy,enjoyable
3430989282,1916,640,360,what does the man do as the red car was moving away,1,3,TC,dance,wave his hand and watch,cross the road,squat down,smoking
4657443720,1242,640,480,how does the baby feel sitting on the sofa,4,3,TC,frustrated,calm,energetic,feel relaxed and happy,bored
2399529939,1581,480,360,what was the man doing as the boy sang,1,7,TC,sing,looking at boy,clapping,wushu,push swing
8040040139,1044,640,360,what was the white dog doing as the black dog ran to catch the ball the second time,3,6,TC,play with another ball,fast running,nod head,stand and watch,chase after it
10830982353,553,640,1138,what is the man in black jacket doing while the others are packing the food,3,4,TC,sitting,take the cards up,chew,eating,carry cake
3210715355,1195,640,480,what does the boy in blue beanie do as the boy in goggles is talking at the start,3,6,TC,carry bottle,pulls the popper,take the float,speaking something,stand up
4608689081,834,640,480,what is the man standing on the left doing in the living room,3,0,TC,having a conversation,to return ball to thrower,answer a call,taking pictures,adjust sound
4177405471,775,640,480,how did the boy look like while the person puts a cake in front,3,7,TC,angry,sad,excited,confused,happy
5987596954,324,640,360,what did the lady in purple do as the dancer started dancing at the beginning of the video,1,6,TC,eat food,squat,turns around,happy,move to the back
6025249212,376,640,360,how are the two children s hands positioned at the start of the video,4,7,TC,on the the table,beside the table,on the microphone,playing the piano,fingers apart
8023214726,1350,640,480,how did the lady in pink reacvted to the lady in black s speech at the beginning of the video,3,0,TC,swing her arms,look at camera turn around,pour paint on the paper,laugh,walk to boy in white
5932671106,1183,640,480,what is baby inside the tent seen first doing with the bottle,3,11,TC,shake bottle,burying bottle,throw bottle,licking it,grab bottle
2465842956,764,500,375,what are the puppies doing under the dog,2,4,TC,look at baby,train the dog,feeding,try to get out,sniff the babys head
10351221684,327,640,360,how is the girl feeling at the start of the video,1,8,TC,confused but calm,happy,angry,friendly,embarrassed
6349106171,1780,604,1072,what does the man in white do as the man in brown talks to him,2,0,TC,frown and walk away,hold skateboard,cross his arms and look in front,move towards the woman,standing and watching
3513109378,1800,640,480,what is the lady in blue doing as the children are sitting in the car,0,1,TC,driving,follow behind,yes,stand at the side and talk,bite a slip of paper
5292466003,2697,640,480,what is the activity that they are doing,0,8,TC,snow sledding,bull riding,mountain scaling,baseball,hiking
8786428415,1023,640,360,what do the two men standing do as they sing,2,0,TC,playing their instrument,watch him,play the guitar,looking around,playing the keyboard
3207044928,920,640,480,what does the girl in grey do with her hands when the camera turns to her,1,1,TC,walk away,move her hand to the beat,brush the grey object,point also,bag
8690437931,318,640,360,what does the girl wear on her body as she plays with the water,0,5,TC,life vest,pizza,multicolor box,balloon,rain coat
3701610241,1168,640,480,what activity is being carried out,2,7,TC,playing at living room,boxing,flying aeroplane,woman talking to the crowd,playing balloons
3314671628,2697,640,428,how are the people feeling on the ride in the car,1,3,TC,amused,happy,nervous,engaged,curious
4186550878,1289,640,360,how does the lady react when the boy finishes playing his piece,0,9,TC,grab the paper,talk,laughing,watching television,watch
2399809077,2697,480,360,how did the girl carry her backpack,1,0,TC,swing the ball,over her right shoulder,pick up blanket,looking at the baby,looking at a book
5504570766,1355,640,480,what was the cat doing as the man carried the bunny away,2,5,TC,move to table,lick man,look at them,stretch,look at bird
8514010198,943,640,360,what happened in the middle when the black dog is jumping,2,8,TC,standing still,gesture to dog,snow splashes,look at them,turn around
2610839960,2158,320,240,what does the man in black do as the ladies fight,4,2,TC,walking,talking to each other,ducks and fight back,bleed,observe
8448503290,2550,640,480,what is the lady sitting on the chair doing,4,3,TC,adjusting techincal stuff,playing with the dog,pottery,working,observing the baby
2410572701,1024,320,240,what does the man in grey do as the man in black pointed forward at the start,3,5,TC,listen to music,drink,waiting,move backwards,stand beside
5778842552,1313,640,360,how did the dog reacted when the cat jumped in front of it,2,9,TC,licking each other,hit the bird,jump back,ducked down,climbing over it
8670316021,1213,640,360,how do we know that the girl in the red is the catcher,4,8,TC,walk over,jumps,gets off the bed,hold the microphone,catching other girls
8160552920,1457,604,1072,how did the dog react when its limbs are moved by the girl,3,5,TC,turn his head,wave at it,looks at the direction,moved back to the wall,follow after the girl
9448761012,2698,640,360,what does the man in blue first do when he came out and faced the crowd,1,2,TC,happy,open his hands wide,look at camera,walk back to camera,aiming and shooting
4254574573,975,640,360,what happens to the cat when the human touches the screen,0,0,TC,stretches,close eyes,push it,jumps down,caress cst
4447314310,1282,640,480,what did the baby do when he saw another sheep a distance away from him,4,3,TC,happy,pointing at sheep,looking left and right,eat snow from ground,run to it
5719002896,1814,640,480,who were the people present on the stage,1,9,TC,six guitarists,two guitarists,five pianist,eight singers,four dancers
9367857320,1729,640,360,what does the woman do whenever she looks away from her guitar,2,8,TC,walk away,touch her own face,sings on the microphone,turn her front,laugh
2909879378,359,640,480,what was the baby boy at the right side doing as the girl slide down,4,5,TC,continues crawling,jump,watch,look at her,sit on swing
12101954246,1527,272,480,what are the cats doing in this video,1,7,TC,playing with a toy,searching for food,laying on the mat,show the camera something,play toy
11664231455,1966,640,360,what did the grey cat do when the white cat was scratching itself,3,9,TC,get fed,stop licking,jumped back,lie on ground,licks himself
7478064282,1172,640,360,how do the people feel while hanging out with one another,1,7,TC,find it funny,happy,relaxed,restricted,bored and sleepy
4061202144,2697,640,360,what does the lady do when the baby spits the food out in the middle,1,3,TC,drink the drinks,push food back in the mouth,lick her finger,scoop it back,cap
5605876260,2697,640,360,what did the white dog do when it saw the brown dog stopped chasing,3,3,TC,follow it,ran back into the cage,bark at the birds,run to the brown dog,pick up the toy
9189371905,647,640,360,what activity is occuring,0,5,TC,board meeting,swimming,feeding egg to fish,having a meal,dancing
4087815687,321,640,480,what activity is being carried out,3,8,TC,carrying baby at beach,walk,playing balloons,dancing,drawing
2715505162,2478,500,375,how does the girl in blue pyjamas react when the chair stops in the middle of the video,3,7,TC,skip and look around,sits down,splash water,she smiles,standing there
5195700916,1806,640,360,what did the man in black jacket do while the man in pink was drinking from the large bowl at the start,3,7,TC,pours te drinks together,hold fork and knife,look at the man in white,watching from behind,drinks the cup
11114765653,1484,640,360,what does the boy do with his finger towards the end of the video,2,6,TC,touching ipad,playing around,point at camera,clean his hands,press the keys
3179829544,717,640,480,how did the baby crawl away from the crowded living room,3,3,TC,look over the sofa,turn back,touch something on the floor,get up the stairs,looked at the sofa
6911198917,672,640,480,how does the man react when he sees the girl on the float,0,5,TC,stretch hand out,smiles,sulk,look at camera,look at his paper
4903918516,1809,640,480,what does the big tiger do at the end,4,9,TC,walk away in river,walk away,hug baby panda,pet the tiger,lick small tiger
5633240388,861,480,352,where did the boy in light blue put his right hand as he looked at the boy in navy blue,4,8,TC,on his hips,on his nose,in his pocket,railings,on his cheek
5540883573,1434,640,360,how did the man with high ankle socks feel while the other man speaks to him at the table,2,1,TC,happy whenever the man kisses them,scared,engaged,tired,distracted
3856397029,1088,640,480,what did the lady do when the baby approached her,1,6,TC,put the red bowl on head,reach her hand out,bend down,playing the piano,playing with the baby
6828183774,824,640,360,what is the man doing outdoors,1,0,TC,sledding,skiing,dancing,running marathon,playing with cats
5078587012,515,320,240,how did the man reacted when the boy moved the man s hand away at the end of the video,3,1,TC,turns toward the cameraman,wave,satisfied,pointing,stand behind baby
4399688985,2098,640,480,how does the baby react when he can not push the stroller over the brown pump,3,8,TC,move it closer to the kid,tries to climb,touch camera,he run away,pull hand away
12641085274,1495,640,480,what did the man in white cap do when his bullets ran out in the middle of the video,4,11,TC,dive into water,make another attack,walk away from room,enter the room,use smaller gun
3910935391,905,640,360,what does the baby do while lying on his back near the end of the video,0,2,TC,hold up toy in hand,shakes legs,sits there,trying to get up,crawl away
4981531978,615,640,480,what do the donkeys do as the lady is jogging,2,0,TC,take a step forward,gallop,follow her,sit on sofa,turn one round
5244004782,568,640,360,how does the woman feel about her barefoot,3,6,TC,curious,carefree,happy,cold,found it funny
2694427613,1923,500,375,what does the man in grey do as the man in pink is standing up and talking,2,2,TC,looks in the camera,talk and watch him do trick,laughing,film the machine,writing something
3416353558,1643,240,320,how does the lady feel while reading from the paper,4,6,TC,refreshing,restless,confused but calm,unhappy,happy
9132237408,1186,640,360,what season were the two men experiencing while they were outdoors,4,6,TC,feeding cat,moves it backward,dance battle,frisbee,autumn
5542298519,2100,640,360,how did the white sheep react when the black and white dog walks past it,3,7,TC,kicks the black and white dog,jump up,run away,no reaction,walks away
9988805544,995,640,480,what did the lady do as she spoke to the camera at the end of the video,2,9,TC,smiles,paper,shake her head,point at herself again,clap
2708580590,2085,320,240,how are the children reacting as they are on the float,3,5,TC,upset,reluctant,curious,enjoying the activity,look at him
3055012236,1527,500,375,how did the man in black cap ensured he can see clearly,2,7,TC,happy,playing guitar,wear spectacles,opening it,carry cake
8488946514,1825,640,360,what is the lady wearing black clothing doing as she read her book,2,7,TC,looking at her,smile,pointed her reading with pencil,laughing,look at the lady in red
3248050019,2377,640,480,how is the boy positioned at the start,3,6,TC,sitting down,upside down,doing a split,standing,in the air
4260219179,1960,640,480,how does the dog react when the first dog runs off,0,1,TC,follow,run back,same direction as dog,turn away,run around the man
6410117677,1444,640,360,what happened when the girl reached the shelf,0,8,TC,pick up something yellow,playing with balloon,lying on her stomach,read a book,look outside
3133113252,1873,640,360,what does the third elephant at the back do while the front two elephants were playing with each other s trunks,1,3,TC,greet elephants,swimming,follow to cross the road,taking pictures with camera,start crossing
11671714015,2624,640,1138,what does the man in green do as the man in blue was looking up at the start,2,6,TC,drink from cup,construct toy structure,adjusting ope on waist,move to the man in blue,sitting
5424217420,1009,640,360,what does the duck do as the girl was following it at the start,3,4,TC,walking towards the balloon,finding food,keep looking down at pond,walking away,run around the park
3396832512,2115,640,480,what is the response of the cat as the woman hold the piece of meat down at the start,2,5,TC,sleeping,eat,smell and follow the meat,look at grey cat,licked the face
3120429335,820,640,480,what did the lady in green hold up as she sat in the boat in the middle of the video,3,5,TC,takes awayy her headphones,squat down,pull boat,camera,continue walking backwards
5231353095,982,568,320,how does the man appear when he plays the ukelele for performance,4,3,TC,angsty,depressed,sleepy,angry,engaged with music
3628237900,1206,640,480,how is the lion positioned throughout the video,4,9,TC,charges forward,caustious,bent forward,playing in water,resting
12681261204,401,640,360,what is the girl wearing on her head while dancing,2,0,TC,pink hat,sunglasses,hair band,balloon,scarf
6789663234,1355,480,640,what did the man in red do as the girl sang,2,7,TC,play the drums,sit on sofa and listen,moves his head,tapping his leg,looks at her while singing
4149191108,390,640,480,what do the dogs do when the lady moves her hands,1,0,TC,point towards the dog,follow the action,looks at the direction,moved back to the wall,turn towards lady
4769483978,871,640,480,what does the black cat do as the toy was dangling above it at the end,3,1,TC,hold its head,looked at the corner,put it on boy in red,try to reach for it,goes near litter box
3396669412,639,640,360,what does the lady do as the man is standing,0,1,TC,lies on chair,nodding,teaching to read,walk away,picking
5296198015,2697,640,480,what do they do while walking,0,9,TC,talking and smiling,finding the key,dancing,holding dog leash,eating
4856339912,870,320,240,what activity is occuring,0,0,TC,singing,class gatheirng,obstacle challenge for dog,woman talking to the crowd,karoake
4854853022,1218,640,480,what happens to the girls when the kayak bounces up,1,7,TC,swings arms again,body move up,jump as well,hold on the ladder,wave hands
3702189213,432,640,480,what is the dog doing with the toy,3,10,TC,trying to sleep,sit down,showering it,biting,pat its head
3017704506,615,640,428,what did the man in black do as the man in blue speaks at the end of the video,0,1,TC,look at him,push camera away,laptop screen,adjusting equipment,talk to man in checkered
3449221506,1174,640,480,what does the lady in bed do at the start of the video,0,3,TC,wave to camera,shakes her waist,cover her face,lick the ice cream,unwrapping present
2522592670,1745,640,480,what does the speaker do with his hand at the end,3,7,TC,adjusting safety wear,continue paddling,put hand on head,hand gestures,vigorously move baby s arms
2749616841,930,640,360,how does the kitten react to the way the person is interacting with it,1,2,TC,relaxed,excited and fidgety,puts it back,licking each other,move its head
3359783439,1585,320,240,what did the man do near the end when he reaches the shore,2,6,TC,lean against the screen,walk off,raise his hands,get horse to turn,turn back and smile
4946916131,396,640,360,what does the dog do as the cat was walking across the sofa,2,0,TC,walk past it,lie and hug cat,resting,walks away,jump onto sofa
9778931443,586,640,360,how is the boy feeling as he plays with his toy car,3,1,TC,sad,angry,uncomfortable,happy,hungry
11003460806,1035,640,480,what is currently happening in this video,3,8,TC,drinking and talking,someone playing with baby,swimming,performance,martial arts class
4198283989,1877,640,480,what does the person in black do after he turns around and talks to another person,3,2,TC,face the audience,amplify his voice,hit the note,start singing again,squat down
6663748603,1945,640,360,what does the man in red do as he reads the book,3,1,TC,open newspapers,smoke cigarette,taps his side,talking,put the cards down
5325583358,2697,640,360,what activity is being carried out,2,6,TC,dancing,drawing,bull riding,feeding animals,walking dog
11329995395,667,640,360,what is the girl in pink doing as the girl in black speaks,3,6,TC,touching baby s hand,selecting bag,drinking wine from the glass,reading her paper,watching them
2955511140,405,640,480,what does the lady in purple do as the other people are admiring the view,3,0,TC,no using phone,singing,amused,take photo,raise arms to pose
4747203885,1732,640,480,what is the woman in white doing when the two ladies in red are opening the wine bottles,4,0,TC,dancing,watching the crane,holding the bottle,preparing the food,walking towards the man in white
9251779370,378,640,480,what are the people doing in the video,3,3,TC,have a meal,singing,palying games,talking and drinking,performance
10315129403,465,640,360,how do the two people feel as they looked at the camera,4,6,TC,interestesd,happy celebrating the girl s birthday,bored,move hands on it,happy
4612106647,537,640,384,how did the boy feel when he climb monkey bars successfully from one end to another,3,1,TC,energetic,restless,relaxed,happy,laughs
5336600324,1155,640,480,what did the baby do as the camera moved around her,0,4,TC,tried to touch camera,laugh,drinking milk,eating,try to crawl
4937452721,1213,640,360,what is lady trying to do by hiding kid in her hands,0,2,TC,teaching her to play keyboard,carry baby,kiss the baby,gesture at camera,rocking baby
4020090190,355,640,360,what is the man doing as he stood in front of the cars,4,5,TC,cut wood,turned to look at baby,rope,waves,speaking
7933516656,1080,640,360,how do the bears interact with one another at the beginning,2,3,TC,put hand on floor,wag their tails,mouthing one another,close eyes,put its head close
4533035526,2401,640,360,what activity is being carried out,1,7,TC,dancing,playing balloons,feeding animals,swing,canoeing
4220014569,2499,640,360,where did the woman in red places her right palm when she was sitting at the table,3,6,TC,on her cheeks,towards the man in white,other side of table,on the black cloth,cover her mouth
